{
  "skill_name": "quant",
  "skill_dir": "D:\\GM-SkillForge\\skillforge\\src\\skills\\quant",
  "scanned_at": "2026-03-15T15:23:44Z",
  "rule_set_version": "1.0.0-t4",
  "scan_statistics": {
    "files_scanned": 7,
    "total_lines_scanned": 1298,
    "total_hits": 0,
    "by_category": {},
    "by_severity": {}
  },
  "findings": {
    "critical": [],
    "high": [],
    "medium": [],
    "low": []
  }
}