{
  "skill_name": "clean_skill",
  "skill_dir": "D:\\GM-SkillForge\\run\\T4_evidence\\rule_samples\\clean_skill",
  "scanned_at": "2026-03-15T13:07:22Z",
  "rule_set_version": "1.0.0-t4",
  "scan_statistics": {
    "files_scanned": 1,
    "total_lines_scanned": 10,
    "total_hits": 0,
    "by_category": {},
    "by_severity": {}
  },
  "findings": {
    "critical": [],
    "high": [],
    "medium": [],
    "low": []
  }
}